<?xml version="1.0" encoding="utf-8"?>
<theme
        xmlns:xsi="http://www.w3.org/2001/XMLSchema-instance"
        xsi:noNamespaceSchemaLocation="../../theme_schema.xsd"
>
    <lang>fr</lang>
    <tag>train</tag>
    <words>
        <word>
            <value>rail</value>
        </word>
        <word>
            <value>locomotive</value>
        </word>
    </words>
</theme>

