<?xml version="1.0" encoding="utf-8"?>
<theme
    xmlns:xsi="http://www.w3.org/2001/XMLSchema-instance"
    xsi:noNamespaceSchemaLocation="../../theme_schema.xsd"
>
    <lang>fr</lang>
    <tag>test</tag>
    <words>
        <word>
            <value>phpunit</value>
        </word>
        <word>
            <value>test</value>
            <value>testing</value>
        </word>
        <word weight="0.5">
            <value>error</value>
        </word>
    </words>
</theme>
